{
  "id": "frag_fens_sluice_book",
  "region": "fens",
  "set": "fens",
  "order": 3,
  "title": "The Sluice-Book",
  "text": "Gates three and four untended since the second watch. The bound lock-men are lying in the sluice. The water is coming up the chapel steps.",
  "note": "Found in the Sluice, for whoever held it long enough to look. The last entry runs off the page.",
  "where": "Deep in the Canal Locks"
}
