{
  "id": "frag_vale_standing_order",
  "region": "vale",
  "set": "vale",
  "order": 1,
  "title": "Standing Order 14",
  "text": "Standing order 14: the Third Legion holds the Wickham road until relieved. — Stamped by the Ember Throne, Year 612.",
  "note": "Found in a chest in the Old Barrows. They are still holding it.",
  "where": "Somewhere in the Old Barrows, first floor"
}
