{
  "id": "frag_fens_tithe_plate",
  "region": "fens",
  "set": "fens",
  "order": 5,
  "title": "A Tithe-Boat's Plate",
  "text": "Tithe-boat Ninth. The Drowned Abbey to the Ember Throne. Cargo: lamps, forty.",
  "note": "It hung in the Toadking's Boat Hall. He took it off a hull because he liked the shine.",
  "where": "Deep in Toadking's Mound"
}
