{
  "id": "frag_vale_gate_warden_note",
  "region": "vale",
  "set": "vale",
  "order": 5,
  "title": "A Gate-Warden's Note",
  "text": "Relief column expected by the harvest moon. Keep the road open. Keep the lamps lit.",
  "note": "From a shrine in Wickham Keep. Somebody kept the lamps lit for a long time.",
  "where": "Somewhere in Wickham Keep, first floor"
}
