{
  "id": "frag_vale_muster_roll",
  "region": "vale",
  "set": "vale",
  "order": 2,
  "title": "The Muster Roll",
  "text": "Muster roll, Third Legion, second cohort, at the Wickham road: two hundred and forty bound, two hundred and forty present. There are never absences.",
  "note": "From the second floor of the Old Barrows. Somebody counted them every morning.",
  "where": "Somewhere in the Old Barrows, second floor"
}
