{
  "id": "frag_fens_drain_order",
  "region": "fens",
  "set": "fens",
  "order": 7,
  "title": "The Drain Order",
  "text": "If the gates fail, open the vats to the canal. Better drowned than loose.",
  "note": "On a shrine at Vat Seven, under the Locks. Somebody opened them.",
  "where": "The Canal Locks, Vat Seven"
}
