{
  "id": "frag_fens_reed_stick",
  "region": "fens",
  "set": "fens",
  "order": 4,
  "title": "A Reed-Cutter's Stick",
  "text": "Four boats off the flood, the night the water came. Nobody aboard. One had a lamp in the bow, still lit.",
  "note": "Notched and burned, in a chest on Toadking's Mound. The reed-cutters keep their tallies this way still.",
  "where": "Somewhere on Toadking's Mound, first floor"
}
