{
  "id": "frag_vale_centurion_tablet",
  "region": "vale",
  "set": "vale",
  "order": 3,
  "title": "A Centurion's Tablet",
  "text": "The bound dropped where they stood at the second watch. The living asked me what now. I told them: hold the road until relieved.",
  "note": "Found in a stairs-down hall of the Old Barrows. Nobody came to relieve them.",
  "where": "Somewhere in the Old Barrows, second floor"
}
