{
  "id": "frag_vale_binding_rite",
  "region": "vale",
  "set": "vale",
  "order": 8,
  "title": "The Binding Rite",
  "text": "Speak the order last. The bound keep the last thing they hear.",
  "note": "On the Sunken Chapel's second floor.",
  "where": "Somewhere in the Sunken Chapel, second floor"
}
