{
  "id": "frag_fens_vat_ledger",
  "region": "fens",
  "set": "fens",
  "order": 6,
  "title": "The Vat-Master's Ledger",
  "text": "Vat seven: forty bound, steeped. The Abbey's lamps want filling by the new moon.",
  "note": "Found in a chest in the Sickpools, dry, which nothing else there is.",
  "where": "Somewhere in the Sickpools, first floor"
}
