{
  "id": "frag_fens_day_book",
  "region": "fens",
  "set": "fens",
  "order": 9,
  "title": "The Abbess's Day-Book",
  "text": "The Throne is dark. The bound will not lie down without the order, and there is no one left to give it. We will keep the hours.",
  "note": "Found in the Choir, for whoever held it long enough to look.",
  "where": "Deep in the Drowned Abbey"
}
