{
  "id": "frag_vale_chaplains_last_page",
  "region": "vale",
  "set": "vale",
  "order": 9,
  "title": "The Chaplain's Last Page",
  "text": "The Throne went dark tonight. I cannot bind a second order over the first. Forgive me.",
  "note": "From the Sunken Chapel's second-floor hall, where the robed stranger was digging.",
  "where": "The Sunken Chapel, second floor"
}
