{
  "id": "frag_fens_novice_letter",
  "region": "fens",
  "set": "fens",
  "order": 8,
  "title": "A Novice's Letter",
  "text": "Mother, they let me write the names today. Most of them volunteered. I asked the Abbess about the rest, and she gave me more names to write.",
  "note": "Found in a chest in the Drowned Abbey. It was never sent.",
  "where": "Somewhere in the Drowned Abbey, first floor"
}
