{
  "id": "frag_vale_last_dispatch",
  "region": "vale",
  "set": "vale",
  "order": 6,
  "title": "The Last Dispatch",
  "text": "To the Third Legion at the Wickham road: the Throne is dark. No relief will come. Stand down.",
  "note": "Sealed, and never sent. Captain Garrow had it with his ledgers and never broke the seal.",
  "where": "Wickham Keep, second floor"
}
